{
  "repo_id": "realvuln-cmdi-mini",
  "commit_sha": "aaaaaaaaaaaaaaaaaaaaaaaaaaaaaaaaaaaaaaaa",
  "language": "python",
  "framework": "flask",
  "authorship": "human_authored",
  "findings": [
    {
      "id": "c-1",
      "file": "vuln.py",
      "location": {
        "start_line": 10,
        "end_line": 10,
        "function": "ping"
      },
      "primary_cwe": "CWE-78",
      "acceptable_cwes": [
        "CWE-78"
      ],
      "is_vulnerable": true,
      "severity": "high",
      "cluster_id": "example_command_injection",
      "evidence": {
        "source": "manual_review",
        "description": "request arg flows to os.system"
      }
    }
  ]
}